{"app":{"id":"dev.doodad.media","manifest_sha256":"007a575e3e92f7d9f11aa4af1b208b7207390bb80703e5c58a17cdc712d9e82c","package_sha256":"0cf8e1794ae9fd2f11695b5ad85aab82ff9e43cf572e4b93785b2f65e4a24933","slug":"media","wasm_sha256":"901fc2bda857a8bc2bbe72fc77a356fcf2ccf8bdadbdf151501a9ff00c81757e"},"entries":[{"after_snapshot_sha256":"df11c0fc6fe5722d20f3dd3bef1f35a62adcc9dc305b021d7149a3f86ff01cad","before_snapshot_sha256":null,"cause":{"kind":"start"},"mount":{"bytes":253,"path":"objects/8e59e7d5ee8cba1ad8cd8e89c7dd6668c5f367327a0cbc32aa854630c117154a.cbor","sha256":"8e59e7d5ee8cba1ad8cd8e89c7dd6668c5f367327a0cbc32aa854630c117154a"},"outcome":"committed","route_generation":1,"scenario_time_ms":0,"scene_revision":1,"screen_id":"media.home","sequence":0,"snapshot":{"bytes":1234,"path":"snapshots/df11c0fc6fe5722d20f3dd3bef1f35a62adcc9dc305b021d7149a3f86ff01cad.json","sha256":"df11c0fc6fe5722d20f3dd3bef1f35a62adcc9dc305b021d7149a3f86ff01cad"}},{"after_snapshot_sha256":"0c04d1ef9613a1eb90a58dc50781b648344058bd62eea60ef067470aadb5377c","before_snapshot_sha256":"df11c0fc6fe5722d20f3dd3bef1f35a62adcc9dc305b021d7149a3f86ff01cad","cause":{"action_id":"media.primary","event_kind":"tap","kind":"semantic_action","node_id":"media.primary"},"cause_payload":{"bytes":56,"path":"causes/e1209c1d33100767853e3effe9f25f66a9c6e681ab50d93a71ef82f2331f9eeb.cbor","sha256":"e1209c1d33100767853e3effe9f25f66a9c6e681ab50d93a71ef82f2331f9eeb"},"mount":{"bytes":409,"path":"objects/a339b80efff6aee4203b1a79b8d1881242397a6da9a0c5b93ebae4dbaea85105.cbor","sha256":"a339b80efff6aee4203b1a79b8d1881242397a6da9a0c5b93ebae4dbaea85105"},"outcome":"committed","route_generation":2,"scenario_time_ms":0,"scene_revision":2,"screen_id":"media.playing","sequence":1,"snapshot":{"bytes":1886,"path":"snapshots/0c04d1ef9613a1eb90a58dc50781b648344058bd62eea60ef067470aadb5377c.json","sha256":"0c04d1ef9613a1eb90a58dc50781b648344058bd62eea60ef067470aadb5377c"}},{"after_snapshot_sha256":"adb650030c61edc716a9c4e0de80a57bf88ef3a71c35045020b1d3b9a38852a5","before_snapshot_sha256":"0c04d1ef9613a1eb90a58dc50781b648344058bd62eea60ef067470aadb5377c","cause":{"action_id":"media.disconnect","event_kind":"tap","kind":"semantic_action","node_id":"media.playing.secondary"},"cause_payload":{"bytes":72,"path":"causes/c6cd751faf721ee0c65f2ab50b9fabb8743aef807cfb395c3381f9fc994fe38d.cbor","sha256":"c6cd751faf721ee0c65f2ab50b9fabb8743aef807cfb395c3381f9fc994fe38d"},"mount":{"bytes":416,"path":"objects/e0764ac0509bb151ccafc30c9d2295bca71bde16ba26f0bc91fd9913ff2ceb5c.cbor","sha256":"e0764ac0509bb151ccafc30c9d2295bca71bde16ba26f0bc91fd9913ff2ceb5c"},"outcome":"committed","route_generation":3,"scenario_time_ms":0,"scene_revision":3,"screen_id":"media.offline","sequence":2,"snapshot":{"bytes":1897,"path":"snapshots/adb650030c61edc716a9c4e0de80a57bf88ef3a71c35045020b1d3b9a38852a5.json","sha256":"adb650030c61edc716a9c4e0de80a57bf88ef3a71c35045020b1d3b9a38852a5"}},{"after_snapshot_sha256":"56f0d9f2fc418a8eec2257031f537c8f42a10437f8b5918404d8cb89523c8ba0","before_snapshot_sha256":"adb650030c61edc716a9c4e0de80a57bf88ef3a71c35045020b1d3b9a38852a5","cause":{"action_id":"media.reconnect","event_kind":"tap","kind":"semantic_action","node_id":"media.offline.primary"},"cause_payload":{"bytes":69,"path":"causes/d7751cca27c5c4ace6e5b51279c1daee6f7bd203e79e27f6a4352e1b5b0005ac.cbor","sha256":"d7751cca27c5c4ace6e5b51279c1daee6f7bd203e79e27f6a4352e1b5b0005ac"},"mount":{"bytes":427,"path":"objects/261540711eedda1a3d1dded98aa0c125cd957bbb006ddad8309f1aca36309123.cbor","sha256":"261540711eedda1a3d1dded98aa0c125cd957bbb006ddad8309f1aca36309123"},"outcome":"committed","route_generation":4,"scenario_time_ms":0,"scene_revision":4,"screen_id":"media.reconciled","sequence":3,"snapshot":{"bytes":1917,"path":"snapshots/56f0d9f2fc418a8eec2257031f537c8f42a10437f8b5918404d8cb89523c8ba0.json","sha256":"56f0d9f2fc418a8eec2257031f537c8f42a10437f8b5918404d8cb89523c8ba0"}}],"environment":{"font_scale_milli":1000,"hashes":{"font":"ce078e2e6ebe6f2b141f92935b6041a9545b32f24acba6ea01c4b241e84b33e6","icons":"33fd9015ea18a0d79987b2210c21c062dfe3c6361ec81d9ef157ca1aceb34333","interpretation_policy":"d1340316703065fc99c35d0302f3fec528c90621c6d37cbb011593b7bb82ad92","simulator_build":"a77862fbfe548ae67fad49416a2f964463de27682811b860dcf227a5a900e90b","theme":"810235b0e764b5e2ab810630f8ea4187208ab980f84a9dec47e4f75559f1e707"},"locale":"en-US","origin":"guest_appspec","profile_id":"watch_square_240","reduced_motion":false,"timezone":"America/Los_Angeles","versions":{"appspec":"1.1","component_set":"1","host_abi":"1","lvgl":"9.5.0","simulator":"parallax-v1","wamr":"2.4.0"}},"id":"media.decisive","scenario_id":"media.decisive","schema_version":1}
