{"app":{"id":"dev.doodad.medication","manifest_sha256":"4b4d4b078c296282157abed1ba1ee0c4b61800e2a8fbb88e0aececc7856af3c9","package_sha256":"49a9f80663ede25d5e69e75f9adfb4ea78644420bf533b0e2fef21f03b510fe1","slug":"medication","wasm_sha256":"6bc2817f7e4ea7f661b20b4a21851b4b3915926343766e6dcd8bee3788cd631e"},"entries":[{"after_snapshot_sha256":"43f65e5e02a253ea2607378c279c228a0bb462d44ac1c3f672c4c10dbe5326dd","before_snapshot_sha256":null,"cause":{"kind":"start"},"mount":{"bytes":445,"path":"objects/0a502c185a4edda4026ebd864844324cb440dd5eaabaef2de746a76b5e747f11.cbor","sha256":"0a502c185a4edda4026ebd864844324cb440dd5eaabaef2de746a76b5e747f11"},"outcome":"committed","route_generation":1,"scenario_time_ms":0,"scene_revision":1,"screen_id":"medication.home","sequence":0,"snapshot":{"bytes":2136,"path":"snapshots/43f65e5e02a253ea2607378c279c228a0bb462d44ac1c3f672c4c10dbe5326dd.json","sha256":"43f65e5e02a253ea2607378c279c228a0bb462d44ac1c3f672c4c10dbe5326dd"}},{"after_snapshot_sha256":"484b9d3ec6a15158a6068e03ab73a73a76171373446cf1ca5760c07b0eba84f7","before_snapshot_sha256":"43f65e5e02a253ea2607378c279c228a0bb462d44ac1c3f672c4c10dbe5326dd","cause":{"action_id":"medication.primary","event_kind":"tap","kind":"semantic_action","node_id":"medication.primary"},"cause_payload":{"bytes":76,"path":"causes/2b4a4a413f9845ad2d62d47dccd59452abc1fbf64c9a9bb80af5f34515fc2bc6.cbor","sha256":"2b4a4a413f9845ad2d62d47dccd59452abc1fbf64c9a9bb80af5f34515fc2bc6"},"mount":{"bytes":489,"path":"objects/86f97e8465bb8c393e8818b044a72ec6ef5de1acf700f4a656178b60514cd26a.cbor","sha256":"86f97e8465bb8c393e8818b044a72ec6ef5de1acf700f4a656178b60514cd26a"},"outcome":"committed","route_generation":2,"scenario_time_ms":0,"scene_revision":2,"screen_id":"medication.taken","sequence":1,"snapshot":{"bytes":2217,"path":"snapshots/484b9d3ec6a15158a6068e03ab73a73a76171373446cf1ca5760c07b0eba84f7.json","sha256":"484b9d3ec6a15158a6068e03ab73a73a76171373446cf1ca5760c07b0eba84f7"}},{"after_snapshot_sha256":"c534d05e21dd7a5e320ee7f5e77f55309a22389967841461a54b0fd5c3bfad20","before_snapshot_sha256":"484b9d3ec6a15158a6068e03ab73a73a76171373446cf1ca5760c07b0eba84f7","cause":{"action_id":"medication.add","event_kind":"tap","kind":"semantic_action","node_id":"medication.taken.primary"},"cause_payload":{"bytes":80,"path":"causes/045fac56047136a9b56e605454002b70c63be2800f14e2c84308d82980c80ea2.cbor","sha256":"045fac56047136a9b56e605454002b70c63be2800f14e2c84308d82980c80ea2"},"mount":{"bytes":480,"path":"objects/e6f5ad300613c8d91fa77f89eef0bee8b4e412f3dc7828e2aa65a3dfd32473c8.cbor","sha256":"e6f5ad300613c8d91fa77f89eef0bee8b4e412f3dc7828e2aa65a3dfd32473c8"},"outcome":"committed","route_generation":3,"scenario_time_ms":0,"scene_revision":3,"screen_id":"medication.editor","sequence":2,"snapshot":{"bytes":2207,"path":"snapshots/c534d05e21dd7a5e320ee7f5e77f55309a22389967841461a54b0fd5c3bfad20.json","sha256":"c534d05e21dd7a5e320ee7f5e77f55309a22389967841461a54b0fd5c3bfad20"}},{"after_snapshot_sha256":"17f35ef170a71d1395651cd1a8a30bb2ac8d76dd624afefb307a3bd0d0aebfa9","before_snapshot_sha256":"c534d05e21dd7a5e320ee7f5e77f55309a22389967841461a54b0fd5c3bfad20","cause":{"action_id":"medication.save","event_kind":"tap","kind":"semantic_action","node_id":"medication.editor.primary"},"cause_payload":{"bytes":83,"path":"causes/c2dc1d4d8704435a44d575b023b92443460d50c66c1f6cd360bebd68425bea73.cbor","sha256":"c2dc1d4d8704435a44d575b023b92443460d50c66c1f6cd360bebd68425bea73"},"mount":{"bytes":465,"path":"objects/8710d2afc2bbf3c11f85ad520164e84e4a2e5da760a1e49aa37a6eff1cb2fd8b.cbor","sha256":"8710d2afc2bbf3c11f85ad520164e84e4a2e5da760a1e49aa37a6eff1cb2fd8b"},"outcome":"committed","route_generation":4,"scenario_time_ms":0,"scene_revision":4,"screen_id":"medication.due","sequence":3,"snapshot":{"bytes":2158,"path":"snapshots/17f35ef170a71d1395651cd1a8a30bb2ac8d76dd624afefb307a3bd0d0aebfa9.json","sha256":"17f35ef170a71d1395651cd1a8a30bb2ac8d76dd624afefb307a3bd0d0aebfa9"}},{"after_snapshot_sha256":"4d72ceb7e77d7d4726d44b6731c1e5dd2a80ca39562263952112997aa71fcf21","before_snapshot_sha256":"17f35ef170a71d1395651cd1a8a30bb2ac8d76dd624afefb307a3bd0d0aebfa9","cause":{"action_id":"medication.snooze","event_kind":"tap","kind":"semantic_action","node_id":"medication.due.secondary"},"cause_payload":{"bytes":81,"path":"causes/f4d644fd34b339675cd6ea3fae7df89c2fc373ca76571259627215f00b65da0d.cbor","sha256":"f4d644fd34b339675cd6ea3fae7df89c2fc373ca76571259627215f00b65da0d"},"mount":{"bytes":513,"path":"objects/7bc80159b60444eb2733b87e4243ff3bacdbb525f960221ad55c50eab92a4e9b.cbor","sha256":"7bc80159b60444eb2733b87e4243ff3bacdbb525f960221ad55c50eab92a4e9b"},"outcome":"committed","route_generation":5,"scenario_time_ms":0,"scene_revision":5,"screen_id":"medication.snoozed","sequence":4,"snapshot":{"bytes":2252,"path":"snapshots/4d72ceb7e77d7d4726d44b6731c1e5dd2a80ca39562263952112997aa71fcf21.json","sha256":"4d72ceb7e77d7d4726d44b6731c1e5dd2a80ca39562263952112997aa71fcf21"}}],"environment":{"font_scale_milli":1000,"hashes":{"font":"e941c007787633311a4b93a97223806270344164ea56fe58feb1340d16730dbc","icons":"33fd9015ea18a0d79987b2210c21c062dfe3c6361ec81d9ef157ca1aceb34333","interpretation_policy":"d1340316703065fc99c35d0302f3fec528c90621c6d37cbb011593b7bb82ad92","simulator_build":"63bc47e96ae676984c093787efc6883ce332a6ed19ba585154a79ed9c3f74001","theme":"810235b0e764b5e2ab810630f8ea4187208ab980f84a9dec47e4f75559f1e707"},"locale":"en-US","origin":"guest_appspec","profile_id":"watch_square_240","reduced_motion":false,"timezone":"America/Los_Angeles","versions":{"appspec":"1.3","component_set":"1","host_abi":"1","lvgl":"9.5.0","simulator":"parallax-v1","wamr":"2.4.0"}},"id":"medication.decisive","scenario_id":"medication.decisive","schema_version":1}
