{"app":{"id":"dev.doodad.weather","manifest_sha256":"7d87afcee2a607831d5561d83d3b4c175fa01eed944e93b8205bbb47aedae994","package_sha256":"f56d1c48a63dff345f022c034d189a9485acb7a645734fe46a9a880c7becacef","slug":"weather","wasm_sha256":"7fa401c7227a805fea1aa28663f99dd9b7ee83b8ca5f8b77d026560291f0addb"},"entries":[{"after_snapshot_sha256":"49ca96f2cafe09f0ef874822342351b5092790cb6231df4178facd2fdfabb255","before_snapshot_sha256":null,"cause":{"kind":"start"},"mount":{"bytes":1292,"path":"objects/4573efc58a2ea8ef7078e618de97837ef4923841b35395035c6965a2cbd54ec8.cbor","sha256":"4573efc58a2ea8ef7078e618de97837ef4923841b35395035c6965a2cbd54ec8"},"outcome":"committed","route_generation":1,"scenario_time_ms":0,"scene_revision":1,"screen_id":"weather.home","sequence":0,"snapshot":{"bytes":7177,"path":"snapshots/49ca96f2cafe09f0ef874822342351b5092790cb6231df4178facd2fdfabb255.json","sha256":"49ca96f2cafe09f0ef874822342351b5092790cb6231df4178facd2fdfabb255"}},{"after_snapshot_sha256":"5fd0006b097b93a28a98ca159ba995f2c1431f3a24dc6d0920606264daecfc15","before_snapshot_sha256":"49ca96f2cafe09f0ef874822342351b5092790cb6231df4178facd2fdfabb255","cause":{"event":"provider.delivery","kind":"provider_event","provider":"mock.provider"},"cause_payload":{"bytes":227,"path":"causes/b070989185d9a4377c8144f9a54d78a8244133eea40fd10c81a48b48b69d532e.cbor","sha256":"b070989185d9a4377c8144f9a54d78a8244133eea40fd10c81a48b48b69d532e"},"command_batch":{"bytes":385,"path":"objects/73ce7fc1ff9e0fd1246bb45f08f44c462ed3a302d31f4c02274a664ecf209b67.cbor","sha256":"73ce7fc1ff9e0fd1246bb45f08f44c462ed3a302d31f4c02274a664ecf209b67"},"outcome":"committed","route_generation":1,"scenario_time_ms":0,"scene_revision":2,"screen_id":"weather.home","sequence":1,"snapshot":{"bytes":7137,"path":"snapshots/5fd0006b097b93a28a98ca159ba995f2c1431f3a24dc6d0920606264daecfc15.json","sha256":"5fd0006b097b93a28a98ca159ba995f2c1431f3a24dc6d0920606264daecfc15"}}],"environment":{"font_scale_milli":1000,"hashes":{"font":"5d0c66a7a81435d697d2db9bd9a3bd0eee89a95637694ddb14316429e3eda32d","icons":"33fd9015ea18a0d79987b2210c21c062dfe3c6361ec81d9ef157ca1aceb34333","interpretation_policy":"d1340316703065fc99c35d0302f3fec528c90621c6d37cbb011593b7bb82ad92","simulator_build":"2a3b73788ac923e67520074418ecde432478823f5e0abe8da1ab0f8df25eebad","theme":"810235b0e764b5e2ab810630f8ea4187208ab980f84a9dec47e4f75559f1e707"},"locale":"en-US","origin":"guest_appspec","profile_id":"watch_square_240","reduced_motion":false,"timezone":"America/Los_Angeles","versions":{"appspec":"1.3","component_set":"1","host_abi":"1","lvgl":"9.5.0","simulator":"parallax-v1","wamr":"2.4.0"}},"id":"weather.state-extreme","scenario_id":"weather.state-extreme","schema_version":1}
